{
 "version": "0.17.0",
 "generated": "2026-10-11",
 "plays_snapshot": "2026-10-11",
 "method": "The codex relationship graph, computed from real archive data. Nodes: Aster da Master (the speaker of every family), the 16 codex families (api/v1/codex-families.json), and every figure named on family transmissions. Collaborator figures follow the circle's title-credit rule: parsed from w//ft./feat. fragments in titles, as credited verbatim (build_years.parse_collabs). Producer figures are parsed from the titles' own prod./produced-by fragments (as credited, verbatim; multi-producer credits split on x / & / + / comma). Edges: aster-family (Aster speaks every word in the family), family-figure (weight = shared transmissions), figure-figure co-credit from api/v1/network.json title co-occurrences. Degrees of separation are BFS distances from Aster on this graph: every family is 1 degree (Aster speaks every family directly), every figure is 2 degrees (via the family or families that carry them). The pathfinder's codex-only mode excludes the Aster hub, so figures in families that share no voices honestly report no path. Play counts are the single 2026-10-11 snapshot; upload dates are not recording dates. Titles and metadata only -- never lyrics, never invented bio facts.",
 "artist": {
  "id": "aster",
  "name": "Aster da Master",
  "page": "index.html"
 },
 "families": [
  {
   "id": "fam-the-modes",
   "slug": "the-modes",
   "name": "The Modes",
   "page": "codex/the-modes.html",
   "track_count": 5,
   "total_plays": 10864,
   "words": [
    "litemode",
    "nitemode",
    "night mode"
   ],
   "decoded_status": "unknown"
  },
  {
   "id": "fam-the-castings",
   "slug": "the-castings",
   "name": "The Castings",
   "page": "codex/the-castings.html",
   "track_count": 5,
   "total_plays": 693,
   "words": [
    "cast"
   ],
   "decoded_status": "stated"
  },
  {
   "id": "fam-keys",
   "slug": "keys",
   "name": "Keys",
   "page": "codex/keys.html",
   "track_count": 3,
   "total_plays": 9615,
   "words": [
    "key"
   ],
   "decoded_status": "stated"
  },
  {
   "id": "fam-vessels",
   "slug": "vessels",
   "name": "Vessels",
   "page": "codex/vessels.html",
   "track_count": 2,
   "total_plays": 367,
   "words": [
    "urn",
    "cup"
   ],
   "decoded_status": "stated"
  },
  {
   "id": "fam-wards-and-the-spirit",
   "slug": "wards-and-the-spirit",
   "name": "Wards & the Spirit",
   "page": "codex/wards-and-the-spirit.html",
   "track_count": 2,
   "total_plays": 453,
   "words": [
    "ward",
    "spirit"
   ],
   "decoded_status": "stated"
  },
  {
   "id": "fam-the-rites",
   "slug": "the-rites",
   "name": "The Rites",
   "page": "codex/the-rites.html",
   "track_count": 17,
   "total_plays": 11052,
   "words": [
    "ritual",
    "solstice",
    "freestyle",
    "anthem",
    "intro",
    "outro",
    "interlude"
   ],
   "decoded_status": "stated"
  },
  {
   "id": "fam-light",
   "slug": "light",
   "name": "Light",
   "page": "codex/light.html",
   "track_count": 9,
   "total_plays": 14142,
   "words": [
    "lightning",
    "white",
    "sun",
    "gold",
    "shine",
    "shines"
   ],
   "decoded_status": "stated"
  },
  {
   "id": "fam-dark",
   "slug": "dark",
   "name": "Dark",
   "page": "codex/dark.html",
   "track_count": 5,
   "total_plays": 11992,
   "words": [
    "dark",
    "night"
   ],
   "decoded_status": "stated"
  },
  {
   "id": "fam-journeys",
   "slug": "journeys",
   "name": "Journeys",
   "page": "codex/journeys.html",
   "track_count": 4,
   "total_plays": 6767,
   "words": [
    "trips",
    "walk"
   ],
   "decoded_status": "stated"
  },
  {
   "id": "fam-the-cold",
   "slug": "the-cold",
   "name": "The Cold",
   "page": "codex/the-cold.html",
   "track_count": 4,
   "total_plays": 15198,
   "words": [
    "colder"
   ],
   "decoded_status": "stated"
  },
  {
   "id": "fam-power",
   "slug": "power",
   "name": "Power",
   "page": "codex/power.html",
   "track_count": 3,
   "total_plays": 2057,
   "words": [
    "power"
   ],
   "decoded_status": "stated"
  },
  {
   "id": "fam-the-pack",
   "slug": "the-pack",
   "name": "The Pack",
   "page": "codex/the-pack.html",
   "track_count": 2,
   "total_plays": 175,
   "words": [
    "dogs"
   ],
   "decoded_status": "stated"
  },
  {
   "id": "fam-lucid-states",
   "slug": "lucid-states",
   "name": "Lucid States",
   "page": "codex/lucid-states.html",
   "track_count": 2,
   "total_plays": 1093,
   "words": [
    "lucid",
    "dreamed"
   ],
   "decoded_status": "stated"
  },
  {
   "id": "fam-time",
   "slug": "time",
   "name": "Time",
   "page": "codex/time.html",
   "track_count": 2,
   "total_plays": 1498,
   "words": [
    "time"
   ],
   "decoded_status": "stated"
  },
  {
   "id": "fam-soul",
   "slug": "soul",
   "name": "Soul",
   "page": "codex/soul.html",
   "track_count": 2,
   "total_plays": 14094,
   "words": [
    "soul"
   ],
   "decoded_status": "stated"
  },
  {
   "id": "fam-fire-and-water",
   "slug": "fire-and-water",
   "name": "Fire & Water",
   "page": "codex/fire-and-water.html",
   "track_count": 2,
   "total_plays": 628,
   "words": [
    "fire",
    "water"
   ],
   "decoded_status": "stated"
  }
 ],
 "figures": [
  {
   "id": "fig-p-addy",
   "name": "Addy",
   "kind": "producer",
   "page": null,
   "family_count": 1,
   "families": [
    {
     "family_id": "fam-the-rites",
     "family_slug": "the-rites",
     "family_name": "The Rites",
     "family_page": "codex/the-rites.html",
     "transmissions": 1,
     "titles": [
      "[outro] Off Beat ft. Yung Vetta (prod. Addy)"
     ]
    }
   ]
  },
  {
   "id": "fig-p-antropolita",
   "name": "Antropolita",
   "kind": "producer",
   "page": null,
   "family_count": 1,
   "families": [
    {
     "family_id": "fam-light",
     "family_slug": "light",
     "family_name": "Light",
     "family_page": "codex/light.html",
     "transmissions": 1,
     "titles": [
      "GOLD 💛💔💛 ~ (prod. Antropolita)"
     ]
    }
   ]
  },
  {
   "id": "fig-p-apostle",
   "name": "Apostle",
   "kind": "producer",
   "page": null,
   "family_count": 1,
   "families": [
    {
     "family_id": "fam-power",
     "family_slug": "power",
     "family_name": "Power",
     "family_page": "codex/power.html",
     "transmissions": 1,
     "titles": [
      "POWER~! (brb)(prod. Apostle)"
     ]
    }
   ]
  },
  {
   "id": "fig-p-asa41",
   "name": "asa41",
   "kind": "producer",
   "page": null,
   "family_count": 1,
   "families": [
    {
     "family_id": "fam-the-cold",
     "family_slug": "the-cold",
     "family_name": "The Cold",
     "family_page": "codex/the-cold.html",
     "transmissions": 1,
     "titles": [
      "getting colder w/ capoxxo (prod. pvscale x asa41)"
     ]
    }
   ]
  },
  {
   "id": "fig-p-astral-hp",
   "name": "astral_hp",
   "kind": "producer",
   "page": null,
   "family_count": 1,
   "families": [
    {
     "family_id": "fam-the-rites",
     "family_slug": "the-rites",
     "family_name": "The Rites",
     "family_page": "codex/the-rites.html",
     "transmissions": 1,
     "titles": [
      "Intro (prod. astral_hp)"
     ]
    }
   ]
  },
  {
   "id": "fig-p-awfl",
   "name": "AWFL",
   "kind": "producer",
   "page": null,
   "family_count": 1,
   "families": [
    {
     "family_id": "fam-the-rites",
     "family_slug": "the-rites",
     "family_name": "The Rites",
     "family_page": "codex/the-rites.html",
     "transmissions": 1,
     "titles": [
      "For Brian (Neck Deep) outro [produced by AWFL]"
     ]
    }
   ]
  },
  {
   "id": "fig-p-brokn",
   "name": "Brokn",
   "kind": "producer",
   "page": null,
   "family_count": 1,
   "families": [
    {
     "family_id": "fam-the-cold",
     "family_slug": "the-cold",
     "family_name": "The Cold",
     "family_page": "codex/the-cold.html",
     "transmissions": 1,
     "titles": [
      "When the World Gets Colder (prod. Brokn)"
     ]
    }
   ]
  },
  {
   "id": "fig-p-bygus",
   "name": "bygus",
   "kind": "producer",
   "page": null,
   "family_count": 1,
   "families": [
    {
     "family_id": "fam-wards-and-the-spirit",
     "family_slug": "wards-and-the-spirit",
     "family_name": "Wards & the Spirit",
     "family_page": "codex/wards-and-the-spirit.html",
     "transmissions": 1,
     "titles": [
      "P1aced a Ward (prodbygus)"
     ]
    }
   ]
  },
  {
   "id": "fig-capoxxo",
   "name": "capoxxo",
   "kind": "collaborator",
   "page": "circle/capoxxo.html",
   "family_count": 1,
   "families": [
    {
     "family_id": "fam-the-cold",
     "family_slug": "the-cold",
     "family_name": "The Cold",
     "family_page": "codex/the-cold.html",
     "transmissions": 1,
     "titles": [
      "getting colder w/ capoxxo (prod. pvscale x asa41)"
     ]
    }
   ]
  },
  {
   "id": "fig-p-capsctrl",
   "name": "capsctrl",
   "kind": "producer",
   "page": null,
   "family_count": 1,
   "families": [
    {
     "family_id": "fam-the-rites",
     "family_slug": "the-rites",
     "family_name": "The Rites",
     "family_page": "codex/the-rites.html",
     "transmissions": 1,
     "titles": [
      "Elf Anthem Interlude (prod. capsctrl)"
     ]
    }
   ]
  },
  {
   "id": "fig-p-discent",
   "name": "Discent",
   "kind": "producer",
   "page": null,
   "family_count": 1,
   "families": [
    {
     "family_id": "fam-the-rites",
     "family_slug": "the-rites",
     "family_name": "The Rites",
     "family_page": "codex/the-rites.html",
     "transmissions": 1,
     "titles": [
      "Day Comes Freestyle ~(prod. Discent)"
     ]
    }
   ]
  },
  {
   "id": "fig-p-dix2",
   "name": "DIX2",
   "kind": "producer",
   "page": null,
   "family_count": 2,
   "families": [
    {
     "family_id": "fam-the-rites",
     "family_slug": "the-rites",
     "family_name": "The Rites",
     "family_page": "codex/the-rites.html",
     "transmissions": 1,
     "titles": [
      "Fuck Time 3 (outro) [Prod. DIX2]"
     ]
    },
    {
     "family_id": "fam-time",
     "family_slug": "time",